{
  "region": "JP",
  "year": 2026,
  "lastUpdated": "2025-01-15",
  "holidays": [
    {"date": "2026-01-01", "name": "元日", "isOffDay": true},
    {"date": "2026-01-12", "name": "成人の日", "isOffDay": true},
    {"date": "2026-02-11", "name": "建国記念の日", "isOffDay": true},
    {"date": "2026-02-23", "name": "天皇誕生日", "isOffDay": true},
    {"date": "2026-03-20", "name": "春分の日", "isOffDay": true},
    {"date": "2026-04-29", "name": "昭和の日", "isOffDay": true},
    {"date": "2026-05-03", "name": "憲法記念日", "isOffDay": true},
    {"date": "2026-05-04", "name": "みどりの日", "isOffDay": true},
    {"date": "2026-05-05", "name": "こどもの日", "isOffDay": true},
    {"date": "2026-05-06", "name": "振替休日", "isOffDay": true},
    {"date": "2026-07-20", "name": "海の日", "isOffDay": true},
    {"date": "2026-08-11", "name": "山の日", "isOffDay": true},
    {"date": "2026-09-21", "name": "敬老の日", "isOffDay": true},
    {"date": "2026-09-22", "name": "国民の休日", "isOffDay": true},
    {"date": "2026-09-23", "name": "秋分の日", "isOffDay": true},
    {"date": "2026-10-12", "name": "スポーツの日", "isOffDay": true},
    {"date": "2026-11-03", "name": "文化の日", "isOffDay": true},
    {"date": "2026-11-23", "name": "勤労感謝の日", "isOffDay": true}
  ]
}
