{
  "region": "US",
  "year": 2026,
  "lastUpdated": "2025-01-15",
  "holidays": [
    {"date": "2026-01-01", "name": "New Year's Day", "isOffDay": true},
    {"date": "2026-01-02", "name": "New Year Holiday", "isOffDay": true},
    {"date": "2026-01-19", "name": "MLK Day", "isOffDay": true},
    {"date": "2026-02-16", "name": "Presidents Day", "isOffDay": true},
    {"date": "2026-05-25", "name": "Memorial Day", "isOffDay": true},
    {"date": "2026-06-19", "name": "Juneteenth", "isOffDay": true},
    {"date": "2026-07-03", "name": "Independence Day (Observed)", "isOffDay": true},
    {"date": "2026-09-07", "name": "Labor Day", "isOffDay": true},
    {"date": "2026-10-12", "name": "Columbus Day", "isOffDay": true},
    {"date": "2026-11-11", "name": "Veterans Day", "isOffDay": true},
    {"date": "2026-11-26", "name": "Thanksgiving", "isOffDay": true},
    {"date": "2026-11-27", "name": "Black Friday", "isOffDay": true},
    {"date": "2026-12-24", "name": "Christmas Eve", "isOffDay": true},
    {"date": "2026-12-25", "name": "Christmas Day", "isOffDay": true},
    {"date": "2026-12-31", "name": "New Year's Eve", "isOffDay": true}
  ]
}
