{
  "region": "CN",
  "year": 2025,
  "lastUpdated": "2025-01-15",
  "holidays": [
    {"date": "2025-01-01", "name": "元旦", "isOffDay": true},
    {"date": "2025-01-26", "name": "春节调休", "isOffDay": false},
    {"date": "2025-01-28", "name": "春节", "isOffDay": true},
    {"date": "2025-01-29", "name": "春节", "isOffDay": true},
    {"date": "2025-01-30", "name": "春节", "isOffDay": true},
    {"date": "2025-01-31", "name": "春节", "isOffDay": true},
    {"date": "2025-02-01", "name": "春节", "isOffDay": true},
    {"date": "2025-02-02", "name": "春节", "isOffDay": true},
    {"date": "2025-02-03", "name": "春节", "isOffDay": true},
    {"date": "2025-02-04", "name": "春节", "isOffDay": true},
    {"date": "2025-02-08", "name": "春节调休", "isOffDay": false},
    {"date": "2025-04-04", "name": "清明节", "isOffDay": true},
    {"date": "2025-04-05", "name": "清明节", "isOffDay": true},
    {"date": "2025-04-06", "name": "清明节", "isOffDay": true},
    {"date": "2025-04-27", "name": "劳动节调休", "isOffDay": false},
    {"date": "2025-05-01", "name": "劳动节", "isOffDay": true},
    {"date": "2025-05-02", "name": "劳动节", "isOffDay": true},
    {"date": "2025-05-03", "name": "劳动节", "isOffDay": true},
    {"date": "2025-05-04", "name": "劳动节", "isOffDay": true},
    {"date": "2025-05-05", "name": "劳动节", "isOffDay": true},
    {"date": "2025-05-31", "name": "端午节", "isOffDay": true},
    {"date": "2025-06-01", "name": "端午节", "isOffDay": true},
    {"date": "2025-06-02", "name": "端午节", "isOffDay": true},
    {"date": "2025-09-28", "name": "国庆调休", "isOffDay": false},
    {"date": "2025-10-01", "name": "国庆节", "isOffDay": true},
    {"date": "2025-10-02", "name": "国庆节", "isOffDay": true},
    {"date": "2025-10-03", "name": "国庆节", "isOffDay": true},
    {"date": "2025-10-04", "name": "中秋节", "isOffDay": true},
    {"date": "2025-10-05", "name": "国庆节", "isOffDay": true},
    {"date": "2025-10-06", "name": "国庆节", "isOffDay": true},
    {"date": "2025-10-07", "name": "国庆节", "isOffDay": true},
    {"date": "2025-10-08", "name": "国庆节", "isOffDay": true},
    {"date": "2025-10-11", "name": "国庆调休", "isOffDay": false}
  ]
}
