{
  "region": "KR",
  "year": 2026,
  "lastUpdated": "2025-01-15",
  "holidays": [
    {"date": "2026-01-01", "name": "신정", "isOffDay": true},
    {"date": "2026-02-16", "name": "설날", "isOffDay": true},
    {"date": "2026-02-17", "name": "설날", "isOffDay": true},
    {"date": "2026-02-18", "name": "설날", "isOffDay": true},
    {"date": "2026-03-01", "name": "삼일절", "isOffDay": true},
    {"date": "2026-03-02", "name": "대체공휴일", "isOffDay": true},
    {"date": "2026-05-05", "name": "어린이날", "isOffDay": true},
    {"date": "2026-06-06", "name": "현충일", "isOffDay": true},
    {"date": "2026-08-15", "name": "광복절", "isOffDay": true},
    {"date": "2026-09-24", "name": "추석", "isOffDay": true},
    {"date": "2026-09-25", "name": "추석", "isOffDay": true},
    {"date": "2026-09-26", "name": "추석", "isOffDay": true},
    {"date": "2026-10-03", "name": "개천절", "isOffDay": true},
    {"date": "2026-10-09", "name": "한글날", "isOffDay": true},
    {"date": "2026-12-25", "name": "성탄절", "isOffDay": true}
  ]
}
